Code	Codelist Code	Codelist Extensible (Yes/No)	Codelist Name	CDISC Submission Value	CDISC Synonym(s)	CDISC Definition	NCI Preferred Term
C33645	C77529		Specimen	SUBCUTIS	Subcutaneous Tissue	Adipose and connective tissue located deep to the dermis.	Subcutis
C13280	C77529		Specimen	SWEAT	Sweat	The liquid secreted by the sweat glands. (NCI)	Sweat
C12473	C77529		Specimen	SYNOVIAL MEMBRANE	Synovial Membrane; Synovial Stratum	The connective tissue and synoviocytes that line the inner surface of the joint capsule.	Synovial Membrane
C111323	C77529		Specimen	SYRINX		The vocal organ of a bird located near the tracheal bifurcation.	Syrinx
C77663	C77529		Specimen	TAIL		A flexible appendage caudal to the sacrum.	Tail
C33739	C77529		Specimen	TEAR		The fluid secreted by the lacrimal apparatus.	Tear
C77664	C77529		Specimen	TEAT		A specialized type of nipple distinguished by its large cistern (lactiferous sinus) that connects to the exterior through the teat canal.	Teat
C96299	C77529		Specimen	TENDON SHEATH		A membranous sheet that envelops a tendon.	Tendon Sheath
C13045	C77529		Specimen	TENDON		A band of fibrous connective tissue that joins bone to muscle. (NCI)	Tendon
C32043	C77529		Specimen	TENDON, CALCANEAL		The tendon that, in general, attaches the gastrocnemius muscle to the calcaneous bone in the tarsus.	Achilles Tendon
C12412	C77529		Specimen	TESTIS	Testicle	The male gonad.	Testis
C77668	C77529		Specimen	TESTIS/EPIDIDYMIS		A specimen that contains the testis and epididymis.	Testis/Epididymis
C62484	C77529		Specimen	THORACIC WALL	Chest Wall	The total system of structures outside the lungs that move as a part of breathing; it includes all structures from the skin to the parietal pleura. (NCI)	Chest Wall
C12433	C77529		Specimen	THYMUS	Thymus Gland	A primary lymphoid organ generally located in the mediastinum near the thoracic inlet and/or along lateral aspects of the neck.	Thymus Gland
C132256	C77529		Specimen	TISSUE, UNSPECIFIED		A tissue specimen for which the identity or anatomic origin is not known or specified.	Unspecified Tissue
C12422	C77529		Specimen	TONGUE		The muscular organ in the mouth used in taste perception and food ingestion.	Tongue
C12802	C77529		Specimen	TONSIL		A secondary lymphoid tissue in the mucosa of the pharynx.	Tonsil
C32988	C77529		Specimen	TONSIL, LINGUAL		A tonsil in the mucosa at the root of the tongue.	Lingual Tonsil
C33250	C77529		Specimen	TONSIL, PALATINE		A tonsil in the mucosa of the glossopalatine arch of the oropharynx.	Palatine Tonsil
C33318	C77529		Specimen	TONSIL, PHARYNGEAL	Adenoid	A tonsil in the mucosa of the nasopharynx.	Pharyngeal Tonsil
C12506	C77529		Specimen	TOOTH		A hard calcified structure in the jaw; primarily used for eating.	Tooth
C32258	C77529		Specimen	TOOTH, CANINE	Canine Tooth	A single-cusped (pointed) and usually single-rooted tooth located between the incisors and premolars. (NCI)	Canine Tooth
C32769	C77529		Specimen	TOOTH, INCISOR		A tooth between the canines in either jaw.	Incisor
C33136	C77529		Specimen	TOOTH, MOLAR		A tooth behind the premolars.	Molar Tooth
C32201	C77529		Specimen	TOOTH, PREMOLAR		A tooth between the canine and molar.	Bicuspid Tooth
C12428	C77529		Specimen	TRACHEA	Windpipe	The fibrocartilaginous tube extending from the larynx to the bronchi.	Trachea
C33822	C77529		Specimen	TUNICA VAGINALIS		The visceral and parietal serous membranes lining the testicular pouch.	Tunica Vaginalis
C112425	C77529		Specimen	TYMPANIC BULLA		The bony structure containing an inner lumen within the middle ear.	Tympanic Bulla
C12502	C77529		Specimen	TYMPANIC MEMBRANE	Tympanic Membrane	A thin membrane that separates the external auditory canal from the middle ear.	Tympanic Membrane
C12416	C77529		Specimen	URETER		The tube that extends from each kidney to the urinary bladder.	Ureter
C12417	C77529		Specimen	URETHRA		The tube that extends from the urinary bladder to the urethral opening.	Urethra
C12414	C77529		Specimen	URINARY BLADDER	Urinary Bladder	The distensible sac-like organ that functions as a reservoir of urine, collecting from the kidneys and eliminating via the urethra. (NCI)	Bladder
C13283	C77529		Specimen	URINE		The fluid produced by the kidneys.	Urine
C161570	C77529		Specimen	UTERINE HORN		The portion of the uterus that connects the oviduct to the corpus uteri.	Uterine Horn
C12405	C77529		Specimen	UTERUS	Womb	A hollow muscular organ within which the fertilized egg implants and the embryo/fetus develops during pregnancy.	Uterus
C92436	C77529		Specimen	UTERUS/CERVIX		A specimen that contains the uterus and cervix.	Uterus/Cervix
C77672	C77529		Specimen	UTERUS/OVARY		A specimen that contains the uterus and ovaries.	Uterus/Ovaries
C12407	C77529		Specimen	VAGINA	Vagina	The female genital canal, extending from the uterus to the vulva. (NCI)	Vagina
C12670	C77529		Specimen	VALVE, AORTIC		A cardiac valve located between the left ventricle and the aorta.	Aortic Valve
C12729	C77529		Specimen	VALVE, CARDIAC		A valve located in the heart.	Cardiac Valve
C12753	C77529		Specimen	VALVE, LEFT ATRIOVENTRICULAR	Left Atrioventricular Valve; Mitral Valve	A cardiac valve located between the left atrium and ventricle.	Mitral Valve
C12775	C77529		Specimen	VALVE, PULMONARY		A cardiac valve located between the right ventricle and the pulmonary artery.	Pulmonary Valve
C12805	C77529		Specimen	VALVE, RIGHT ATRIOVENTRICULAR	Right Atrioventricular Valve; Tricuspid Valve	A cardiac valve located between the right atrium and ventricle.	Tricuspid Valve
C12813	C77529		Specimen	VAS DEFERENS	Ductus Deferens	A duct carrying spermatozoa from the epididymides to the urethra.	Vas Deferens
C12814	C77529		Specimen	VEIN	Vein	A blood vessel that carries blood towards the heart.	Vein
C77673	C77529		Specimen	VEIN, AURICULAR		One of the veins of the pinna; in general these veins anastmose with each other or drain into the internal maxillary or superficial temporal vein.	Auricular Vein
C12883	C77529		Specimen	VEIN, BRACHIAL		A vein of the arm/forelimb; in general it arises from the union of the radial and ulnar veins and drains into the axillary vein.	Brachial Vein
C92598	C77529		Specimen	VEIN, CAUDAL	Tail Vein	A vein in the tail of some species.	Caudal Vein
C32286	C77529		Specimen	VEIN, CEPHALIC	Vena Cephalica	A vein of the arm/forelimb; in general it arises from the dorsal venous network of the hand/forefoot and drains into the axillary vein.	Cephalic Vein
C12716	C77529		Specimen	VEIN, FEMORAL		A vein of the thigh; in general it arises from the popliteal vein and drains into the external iliac vein.	Femoral Vein
C12738	C77529		Specimen	VEIN, JUGULAR	Vena Jugularis	One of the veins of the neck; in general it arises from the junction of the maxillary and linguofacial veins and drains into the brachiocephalic or the cranial caval vein.	Jugular Vein
C53055	C77529		Specimen	VEIN, MESENTERIC		A vein of the abdomen; in general it arises from the intestines and pancreas, combines with the splenic vein, and drains into the portal vein.	Mesenteric Vein
C33343	C77529		Specimen	VEIN, PORTAL	Hepatic Portal Vein	A vein lying in the lower part of the abdomen; in general it arises from the junction of the mesenteric and splenic veins and draining into the liver.	Portal Vein
C12776	C77529		Specimen	VEIN, PULMONARY		Any of the veins that carry oxygenated blood from the lungs to the heart.	Pulmonary Vein
C33462	C77529		Specimen	VEIN, RENAL		A vein arising from the kidney; in general it drains into the caudal vena cava vein.	Renal Vein
C33511	C77529		Specimen	VEIN, SAPHENA	Saphenous Vein	A vein of the leg/hindlimb; in general it arises from the venous network of the leg/hindfoot and drains into the femoral vein.	Saphenous Vein
C12817	C77529		Specimen	VEIN, VENA CAVA		The two major veins (caudal or cranial) that carry deoxygenated blood from the body and drain into the right atrium of the heart.	Vena Cava
C114236	C77529		Specimen	VENTRICULUS		The portion of the stomach of some non-mammalian species located between the proventriculus and the small intestine.	Ventriculus
C12679	C77529		Specimen	VESSEL, BLOOD		A tubular structure through which the blood circulates in the body. Blood vessels constitute a network composed of arteries, arterioles, capillaries, venules, and veins. (NCI)	Blood Vessel
C33038	C77529		Specimen	VESSEL, LYMPHATIC		A thin-walled tubular structure through which the lymph circulates in the body.	Lymphatic Vessel
C77666	C77529		Specimen	VOMITUS	Emesis; Vomitus	Partially digested gastric contents that are returned to the mouth or beyond via the vomit reflex present in some species.	Vomitus
C12408	C77529		Specimen	VULVA		The external, visible part of the female genitalia surrounding the urethral and vaginal opening(s).	Vulva
C77665	C77529		Specimen	WHOLE ANIMAL		Referring to the entire body of an animal. (NCI)	Whole Animal
C41067	C77529		Specimen	WHOLE BLOOD		Blood that has not been separated into its various components; blood that has not been modified except for the addition of an anticoagulant. (NCI)	Whole Blood
