Code	Codelist Code	Codelist Extensible (Yes/No)	Codelist Name	CDISC Submission Value	CDISC Synonym(s)	CDISC Definition	NCI Preferred Term
C33068	C77529		Specimen	MUSCLE, MEDIAL RECTUS		A muscle of the eye, in general extending from the annulus of Zinn to the medial aspect of the anterior portion of the eye at the annulus tendineus; primary function is adduction of the eye.	Medial Rectus Muscle
C33259	C77529		Specimen	MUSCLE, PAPILLARY	Papillary Muscle	Any one of the group of small muscles in the heart ventricles, in general extending from the ventricular wall to the free edge of the atrioventricular valves; primary function is to keep the valves closed during ventricular systole.	Papillary Muscle
C33286	C77529		Specimen	MUSCLE, PECTORALIS		A group of muscles on the exterior of the thorax, in general extending from the sternum to the humerus; primary function is movement of the upper forelimb.	Pectoralis Muscle
C117979	C77529		Specimen	MUSCLE, PLANTARIS		A superficial muscle in primates between the soleus and the gastrocnemius; primary function is flexion of the tarsus and femorotibial joint.	Plantaris Muscle
C33420	C77529		Specimen	MUSCLE, PSOAS MAJOR		A muscle located in the iliac region posterior to the psoas minor muscle that originates from the ventral surfaces of the lumbar vertebral bodies, fuses with the Iliacus muscle to form m. ileopsoas and attaches to the femur; primary function is flexion of the hip joint.	Psoas Major Muscle
C33421	C77529		Specimen	MUSCLE, PSOAS MINOR		A muscle located in the iliac region anterior to the psoas major muscle that originates from the last thoracic vertebra and ventral surfaces of the lumbar vertebrae bodies, and attaching caudally to the ileum; the primary function is flexion of the vertebral column.	Psoas Minor Muscle
C33422	C77529		Specimen	MUSCLE, PSOAS		A group of muscles on the abdominal spine, in general extending from the lumbar vertebrae to the femur; the primary function is flexion of the hip joint.	Psoas Muscle
C33441	C77529		Specimen	MUSCLE, QUADRICEPS FEMORIS		A group of muscles in the thigh, in general extending from the pelvis to the patella and tibia; primary function is extension of the femorotibial joint.	Quadriceps Muscle of the Thigh
C53175	C77529		Specimen	MUSCLE, RECTUS FEMORIS		A muscle in the quadriceps femoris muscle group between the vastus lateralis and vastus medialis and lying on the vastus intermedius; primary function is extension of the femorotibilal joint.	Rectus Femoris
C52987	C77529		Specimen	MUSCLE, SEMIMEMBRANOSUS		A muscle located in the posterior compartment of the thigh, in general extending from the ischial tuberosity to the medial tibial condyle; primary function is to extend the leg/hindlimb at the hip and to flex the leg/hindlimb at the knee.	Semimembranosus Muscle
C53176	C77529		Specimen	MUSCLE, SEMITENDINOSUS		A muscle of the thigh, in general extends from the ishium to the medial tibia; primary function is the extension of the hip.	Semitendinosus
C13050	C77529		Specimen	MUSCLE, SKELETAL		Voluntary, striated muscle tissue predominantly associated with the skeleton.	Skeletal Muscle Tissue
C12437	C77529		Specimen	MUSCLE, SMOOTH		Primarily involuntary, non-striated muscle tissue of the internal organs and blood vessels.	Smooth Muscle Tissue
C53075	C77529		Specimen	MUSCLE, SOLEUS		A muscle in the crus, in general extending from the tibia and fibula to the calcaneous; primary function is plantarflexion of the foot.	Soleus
C117980	C77529		Specimen	MUSCLE, STERNOCEPHALICUS		A muscle of the neck extending from the manubrium sterni to the head; primary function is lateral movement of the head and neck.	Sternocephalicus Muscle
C117874	C77529		Specimen	MUSCLE, TIBIALIS ANTERIOR		A muscle that originates from the lateral condyle of tibia, spans the upper two-thirds of the lateral surface of the tibia, and is attached to the first cuneiform and metatarsal bones of the foot. It is a dorsiflexor of the ankle and invertor of the foot.	Tibialis Anterior Muscle
C53079	C77529		Specimen	MUSCLE, TIBIALIS CRANIALIS		A muscle of the crus, in general extending from the tibia to the first metatarsal; primary function is rotation of the foot.	Tibialis Cranialis
C53179	C77529		Specimen	MUSCLE, TRANSVERSUS ABDOMINIS		A muscle in the abdomen, in general extending from the thoracolumbar fascia, iliac crest, inguinal ligament, and the costal cartilages of the lower ribs, and which continues anteriorly as the transverse abdominis aponeurosis, which inserts into the linea alba, the pubic crest, and the pectineal line; primary function is positioning of abdominal contents, lower back support, and ipsilateral trunk rotation.	Transversus Abdominis Muscle
C90604	C77529		Specimen	MUSCLE, TRICEPS BRACHII		A muscle of the proximal arm/forelimb, in general extending from the scapula and humerus to the olecranon of the ulna; primary function is extension of humeroulnar joint.	Triceps Brachii
C117876	C77529		Specimen	MUSCLE, VASTUS INTERMEDIUS		A muscle in the quadriceps femoris muscle group between the vastus lateralis and vastus medialis deep to the rectus femoris; primary function is the extension of the femorotibial joint.	Vastus Intermedius Muscle
C53073	C77529		Specimen	MUSCLE, VASTUS LATERALIS		A muscle in the quadriceps femoris muscle group lateral to the vastus intermedius; primary function is the extension of the femorotibial joint.	Vastus Lateralis
C117736	C77529		Specimen	MUSCLE, VASTUS MEDIALIS		A muscle in the quadriceps femoris muscle group medial to the vastus intermedius; primary function is the extension of the femorotibial joint.	Vastus Medialis Muscle
C32783	C77529		Specimen	MUSCLE, VENTRAL OBLIQUE	Inferior Oblique Muscle	A muscle of the eye, in general extending from the maxillary bone to the inferior lateral aspect of the posterior part of the eye; primary function is lateral rotation of the eye.	Inferior Oblique Muscle
C32790	C77529		Specimen	MUSCLE, VENTRAL RECTUS	Inferior Rectus Muscle	A muscle of the eye, in general extending from the annulus of Zinn to the ventral aspect of the eye at the annulus tendineus; primary function is depression of the eyeball.	Inferior Rectus Muscle
C179827	C77529		Specimen	MUSCLE, ZYGOMATICUS		A muscle extending from the zygomatic bone to the corners of the mouth/upper lip; primary function is to draw the lip superiorly, posteriorly and laterally.	Zygomaticus Muscle
C49594	C77529		Specimen	NASAL TURBINATE	Nasal Concha; Nasoturbinate	The bone that protrudes into the nasal cavity from the skull, variably covered by respiratory, transitional or olfactory epithelium.	Nasal Turbinate
C139163	C77529		Specimen	NASAL TURBINATE, DORSAL CONCHA		The nasal turbinate originating from the ethmoidal crest on the inner wall of the nasal bone and extending to the maxilla.	Dorsal Nasal Turbinate
C139162	C77529		Specimen	NASAL TURBINATE, ETHMOIDAL CONCHA	Ethmoturbinate	The nasal turbinates extending from the ethmoidal crest into the nasal cavity.	Ethmoidal Nasal Turbinate
C139164	C77529		Specimen	NASAL TURBINATE, MIDDLE CONCHA	Media Nasal Concha; Nasal Middle Turbinate	The largest of the ethmoidal nasal turbinates in some species, extending from the ethmoidal crest into the middle of the nasal cavity.	Medial Nasal Turbinate
C139165	C77529		Specimen	NASAL TURBINATE, VENTRAL CONCHA	Maxilloturbinate	The nasal turbinate originating from the conchal crest on the medial wall of the maxilla and extending into the nasal cavity.	Ventral Nasal Turbinate
C77659	C77529		Specimen	NASAL-ASSOCIATED LYMPHOID TISSUE	NALT	The lymphocytic cell population present in the mucosa of the nasopharyngeal duct.	Nasal-Associated Lymphoid Tissue
C12423	C77529		Specimen	NASOPHARYNX		The part of the pharynx above the soft palate, which is continuous with the nasal cavity and extends to the oropharynx.	Nasopharynx
C54024	C77529		Specimen	NERVE ROOT		The initial segment of a nerve after it has branched off from the central nervous system.	Nerve Root
C12466	C77529		Specimen	NERVE		A bundle of neuronal fibers that transmits electrochemical impulses encoding sensory and motor information from one body part to another.	Nerve
C12682	C77529		Specimen	NERVE, BRACHIAL PLEXUS	Brachial Plexus	A nerve network originating from spinal nerves in the cervical and thoracic vertebrae and giving rise to multiple nerves that innervate the arm/forelimb.	Brachial Plexus
C174385	C77529		Specimen	NERVE, CAUDAL PLEXUS		A nerve network originating from the spinal nerves in the sacral and caudal vertebrae and giving rise to multiple nerves that innervate the tail. (NCI)	Caudal Plexus Nerve
C12697	C77529		Specimen	NERVE, COCHLEAR	Acoustic Nerve; Auditory Nerve	The cochlear portion of the vestibulocochlear nerve, which transmits auditory sensory impulses to the cochlear nucleus in the brainstem.	Cochlear Nerve
C12700	C77529		Specimen	NERVE, CRANIAL		Any of the 12 paired nerves that originate in the brain stem. (NCI)	Cranial Nerve
C12714	C77529		Specimen	NERVE, FACIAL	Seventh Cranial Nerve	A cranial nerve extending from the brain stem between the pons and medulla, which innervates the facial muscles, glands and the tongue.	Facial Nerve
C52816	C77529		Specimen	NERVE, FEMORAL		A nerve that originates from the lumbar nerves and innervates the anterior region of the thigh.	Femoral Nerve
C33015	C77529		Specimen	NERVE, LUMBAR		Any of the spinal nerves originating from the lumbar region.	Lumbar Nerve
C52815	C77529		Specimen	NERVE, MEDIAN		A nerve extending from the brachial plexus traveling the length of the arm/thoracic limb, which innervates some flexor muscles of the arm/forelimb and the skin on the palmar aspect of the carpus, metacarpus and digits.	Median Nerve
C12758	C77529		Specimen	NERVE, OCULOMOTOR	Third Cranial Nerve	A cranial nerve extending from the oculomotor nucleus and accessory parasympathetic nucleus, which innervates the pupil, lens, upper eyelid, and eye muscles.	Oculomotor Nerve
C12761	C77529		Specimen	NERVE, OPTIC	Second Cranial Nerve	A cranial nerve extending between the retina and optic chiasma, which innervates the eye.	Optic Nerve
C12768	C77529		Specimen	NERVE, PERIPHERAL		Any nerve outside the brain or spinal cord that connects with peripheral receptors or effectors. (NCI)	Peripheral Nerve
C52814	C77529		Specimen	NERVE, PERONEAL	Nerve, Fibular	A branch of the sciatic nerve that includes the common, deep, and/or superficial peroneal nerves, which innervates multiple muscles in the distal region of the leg/hindlimb.	Peroneal Nerve
C92601	C77529		Specimen	NERVE, PERONEAL, COMMON		The portion of the peroneal nerve that extends from the sciatic nerve to the bifurcation of the deep and superficial peroneal nerves.	Common Peroneal Nerve
C92602	C77529		Specimen	NERVE, PERONEAL, DEEP		A branch of the common peroneal nerve that runs deep to the superficial peroneal nerve and which predominantly innervates the muscles of the crus and foot/hindfoot.	Deep Peroneal Nerve
C92603	C77529		Specimen	NERVE, PERONEAL, SUPERFICIAL		A branch of the common peroneal nerve that runs superficial to the deep peroneal nerve and which predominantly innervates the skin of the crus and foot/hindfoot.	Superficial Peroneal Nerve
C77674	C77529		Specimen	NERVE, PLANTAR		A nerve arising from the tibial nerve and dividing into the medial and lateral plantar nerves, which innervates the skin and muscles of the plantar region of the foot/hindfoot.	Plantar Nerve
C52812	C77529		Specimen	NERVE, RADIAL		A nerve extending from the brachial plexus traveling the length of the arm/forelimb, which innervates the extensor muscles of the elbow, carpus and phalanges, as well as the skin on the dorsal aspect of the carpus, metacarpus and digits.	Radial Nerve
C147511	C77529		Specimen	NERVE, SAPHENOUS		A branch of the femoral nerve traveling the length of the leg/hindlimb, which innervates the sartorius and the skin of the medial aspect of the leg/hindlimb from the knee/stifle joint to the metatarsus.	Saphenous Nerve
C52810	C77529		Specimen	NERVE, SCIATIC		A nerve arising from the merge of the lumbar and sacral rami in the pelvis and dividing into the common peroneal and tibial nerves, and which innervates the muscles of the thigh.	Sciatic Nerve
C12792	C77529		Specimen	NERVE, SPINAL	Spinal Roots	A nerve arising from the spinal cord where the dorsal and ventral roots converge and exit through the intervertebral foramen.	Spinal Nerve
C77675	C77529		Specimen	NERVE, SURAL		A minor branch of the sciatic nerve that includes the lateral and caudal sural nerves, which innervates the skin of the crus, tarsus and metatarsus.	Sural Nerve
C198408	C77529		Specimen	NERVE, THORACIC		Any of the spinal nerves originating from the thoracic region.	Thoracic Nerve
C52809	C77529		Specimen	NERVE, TIBIAL		A branch of the sciatic nerve that divides into the medial and lateral plantar nerves, and which innervates the muscles of the crus and the skin of the tarsus.	Tibial Nerve
C12806	C77529		Specimen	NERVE, TRIGEMINAL	Fifth Cranial Nerve	A cranial nerve extending from the pons, which innervates the skin, mucous membranes, and masticatory muscles of the head.	Trigeminal Nerve
C52807	C77529		Specimen	NERVE, ULNAR		A nerve arising from spinal nerves C8, T1 and T2, which innervates the flexor muscles of the arm/forelimb and skin of the arm/forelimb and lateral manus.	Ulnar Nerve
C12812	C77529		Specimen	NERVE, VAGUS	Tenth Cranial Nerve	A cranial nerve arising from the medulla oblongata, which provides efferent parasympathetic innervation to tissues and viscera in the neck, thorax and abdomen; it also includes somatic and visceral afferent nerve fibers.	Vagus Nerve
C12996	C77529		Specimen	NERVE, VESTIBULOCOCHLEAR	Eighth Cranial Nerve	A cranial nerve extending from the inner ear and entering the cranial cavity through the internal auditory foramen where it joins the brainstem.	Vestibulocochlear Nerve
C12299	C77529		Specimen	NIPPLE		The protuberance in the skin where the ducts of the mammary gland open.	Nipple
C12756	C77529		Specimen	NOSE	Nose	A structure of special sense serving as an organ of the sense of smell and as an entrance to the respiratory tract. (NCI)	Nose
C13197	C77529		Specimen	NUCLEUS	Cell Nucleus	A body within the cell, surrounded by a membrane, within which lie the chromosomes, one or more nucleoli, combined with proteins, and exhibits mitosis. (NCI)	Nucleus
C98765	C77529		Specimen	OLFACTORY REGION		The area of mucosa in the nose lined by olfactory epithelium and containing olfactory glands. (NCI)	Olfactory Region
C98766	C77529		Specimen	OMASUM		The third compartment of the forestomach of ruminants with many long folds of mucosa (resembling a book). (NCI)	Omasum
C33209	C77529		Specimen	OMENTUM		A double layer of peritoneum covering abdominal organs.	Omentum
C12760	C77529		Specimen	OPTIC DISC	Optic Nerve Head	The portion of the retina at which the axons of the ganglion cells exit the eyeball to form the optic nerve.	Optic Disc
C12762	C77529		Specimen	OROPHARYNX		The part of the pharynx between the soft palate and the upper portion of the epiglottis. (NCI)	Oropharynx
C12404	C77529		Specimen	OVARY		The female gonad.	Ovary
C92595	C77529		Specimen	OVARY/OVIDUCT		A specimen that contains the ovary and oviduct.	Ovary/Oviduct
C12403	C77529		Specimen	OVIDUCT	Fallopian Tube	The tube through which eggs pass from an ovary.	Fallopian Tube
C12229	C77529		Specimen	PALATE		The roof of the oral cavity. It separates the oral cavity from the nasal cavity.	Palate
C12230	C77529		Specimen	PALATE, HARD		The part of the roof of the mouth supported by bone.	Hard Palate
C12231	C77529		Specimen	PALATE, SOFT		The part of the roof of the mouth not supported by bone.	Soft Palate
C209711	C77529		Specimen	PAMPINIFORM PLEXUS		A network of veins that drains blood from the testes or ovaries and surrounds the testicular or ovarian artery.	Pampiniform Plexus
C12393	C77529		Specimen	PANCREAS		A digestive organ in the abdomen that has both endocrine and exocrine functions.	Pancreas
C12608	C77529		Specimen	PANCREAS, ENDOCRINE	Endocrine Pancreas	The pancreatic tissue that contains the islets of Langerhans. It is responsible for the production and secretions of the pancreatic hormones. (NCI)	Islet of Langerhans
C119578	C77529		Specimen	PAPILLA, DUODENAL		An opening on the duodenal mucosa where the bile and pancreatic ducts enter the duodenum.	Duodenal Papilla
C12763	C77529		Specimen	PARANASAL SINUS		The air-filled cavities adjacent to the nasal cavity lined by a mucous membrane and located in the bones of the skull.	Paranasal Sinus
C77660	C77529		Specimen	PAW		The entire structure distal to the ankle joint/tarsus or wrist joint/carpus in quadruped animals.	Paw
C12409	C77529		Specimen	PENIS		The male organ of urination and copulation. (NCI)	Penis
C13005	C77529		Specimen	PERICARDIUM		The membrane surrounding the heart and roots of the vessels at the base of the heart.	Pericardium
C33301	C77529		Specimen	PERINEUM	Perineum	The area located between the anus and vulva in females, and anus and scrotum in males. (NCI)	Perineum
C12954	C77529		Specimen	PERIPHERAL BLOOD MONONUCLEAR CELL	PBMC	A peripheral blood cell with a single nucleus, for example lymphocytes and monocytes.	Peripheral Blood Mononuclear Cell
C12770	C77529		Specimen	PERITONEUM		The membrane that lines the abdominal and pelvic cavities.	Peritoneum
C12771	C77529		Specimen	PEYER'S PATCH		An organized aggregate of gut-associated lymphoid tissue located in the mucosa of the small intestine.	Peyer Patch
C12425	C77529		Specimen	PHARYNX		A passageway in the head and neck that includes the nasopharynx, oropharynx and laryngopharynx.	Pharynx
C12292	C77529		Specimen	PINNA	Auricle; External Ear; Pinna	The external part of the ear. (NCI)	External Ear
C13272	C77529		Specimen	PLACENTA		An organ present in true mammals during embryonic developmen that provides the fetus with nutrients and oxygen, facilitates gas and waste exchange between the fetus and mother.	Placenta
C13356	C77529		Specimen	PLASMA		The fluid (acellular) portion of the circulating blood with retained clotting components.	Plasma
C12469	C77529		Specimen	PLEURA		The serous membrane that lines the wall of the thoracic cavity and the surface of the lungs.	Pleura
C12323	C77529		Specimen	PREPUCE	Preputium Penis	A fold of skin covering the end of the penis.	Prepuce
C111301	C77529		Specimen	PROVENTRICULUS		The portion of the stomach of some non-mammalian species located between the thoracic esophagus and the ventriculus.	Proventriculus
C12887	C77529		Specimen	RENAL PELVIS		The funnel-shaped proximal portion of the ureter located within the kidney into which urine is secreted, from the collecting duct system of the kidney. (NCI)	Renal Pelvis
C176412	C77529		Specimen	REPRODUCTIVE TISSUE		Tissue from any of the organs involved in reproduction.	Reproductive Tissue
C33467	C77529		Specimen	RETE TESTIS		A network of tubules that convey sperm from the seminiferous tubules within the testicles to the efferent ducts. (NCI)	Rete Testis
C98777	C77529		Specimen	RETICULUM		Smallest forestomach of ruminants with complex honeycomb folding of mucosa. (NCI)	Reticulum
C12298	C77529		Specimen	RETROPERITONEUM		The region of the abdomen outside the peritoneum, where the kidneys lie and the great blood vessels run.	Retroperitoneum
C179828	C77529		Specimen	ROUND WINDOW NICHE		A bony pouch in the tympanic cavity that is enclosed by the secondary tympanic membrane.	Round Window Niche
C98778	C77529		Specimen	RUMEN	Paunch	Largest forestomach of ruminants where bacterial fermentation occurs. (NCI)	Rumen
C125896	C77529		Specimen	SAC, ANAL		One of two pouches located on either side of the anus of most carnivores that contain the secretions of the anal sac glands.	Anal Sac
C14128	C77529		Specimen	SAC, YOLK		Membranous sac on the ventral aspect of the developing embryo that acts as a primitive circulatory system as well as providing nourishment. (NCI)	Yolk Sac
C13275	C77529		Specimen	SALIVA		A clear liquid secreted by the salivary glands.	Saliva
C12785	C77529		Specimen	SCROTUM		The pouch that encloses the testicles.	Scrotum
C179829	C77529		Specimen	SECONDARY TYMPANIC MEMBRANE	Round Window Membrane	A membrane that encloses the round window niche of the middle ear.	Secondary Tympanic Membrane
C13277	C77529		Specimen	SEMEN		The fluid containing the spermatozoa, secreted by the testes and accessory reproductive glands of the male.	Semen
C13325	C77529		Specimen	SERUM	Sera	The clear portion of the blood that remains after the removal of the blood cells and the clotting proteins. (NCI)	Serum
C33556	C77529		Specimen	SINUS	Sinus	A recess, cavity, or channel. (NCI)	Sinus
C77676	C77529		Specimen	SITE, APPLICATION	Site, Exposure	The anatomic site at which medical intervention is administered. (NCI)	Application Site
C77677	C77529		Specimen	SITE, BIOPSY		The anatomic site targeted for a biopsy procedure. (NCI)	Biopsy Site
C92596	C77529		Specimen	SITE, CATHETER		The anatomic site through which fluid is transferred into or out of the body using a catheter. (NCI)	Catheter Site
C77685	C77529		Specimen	SITE, EXTERIORIZATION		The site of the surgical exposure of an internal organ or tissue. (NCI)	Exteriorization Site
C77678	C77529		Specimen	SITE, IMPLANTATION		The anatomic site at which a material such as a tissue, graft, device or radioactive material is inserted with some intended degree of permanence. This term may also refer to the site of the uterus at which the early embryo is attached.	Implantation Site
C77679	C77529		Specimen	SITE, INFUSION		The anatomic site through which fluid is introduced into the body. (NCI)	Infusion Site
C77680	C77529		Specimen	SITE, INJECTION		The anatomic site at which a medication or a vaccine is injected. (NCI)	Injection Site
C77681	C77529		Specimen	SITE, INJURY		The anatomic site at which damage or harm was suffered. (NCI)	Injury Site
C77682	C77529		Specimen	SITE, MICROCHIP		The anatomic site at which a microchip is implanted. (NCI)	Microchip Site
C147512	C77529		Specimen	SITE, SUBCUTANEOUS PORT		The anatomic site at which a subcutaneous port is implanted.	Subcutaneous Port Site
C77683	C77529		Specimen	SITE, SURGICAL	Incision Site	The anatomic site of a cut made during surgery. The term may also refer to the resultant scar from the surgical procedure. (NCI)	Incision Site
C77684	C77529		Specimen	SITE, TATTOO		The anatomic site at which a tattoo is present. (NCI)	Tattoo Site
C48322	C77529		Specimen	SITE, UNCERTAIN PRIMARY		Referring to the fact that the original site of growth of a metastatic cancer is unknown or uncertain. (NCI)	Primary Site Unknown
C12470	C77529		Specimen	SKIN	Integument; Skin	An organ that constitutes the external surface of the body. It consists of the epidermis, dermis, and skin appendages. (NCI)	Skin
C92441	C77529		Specimen	SKIN/SUBCUTIS		A specimen that contains the epidermis, dermis, and subcutaneous adipose tissue.	Skin/Subcutaneous Tissue
C92437	C77529		Specimen	SMALL COLON		The terminal part of the colon of the horse with a reduced diameter. (NCI)	Small Colon
C12386	C77529		Specimen	SMALL INTESTINE		The villous section of the intestine extending from the pylorus to the proximal large intestine.	Small Intestine
C12263	C77529		Specimen	SMALL INTESTINE, DUODENUM		The portion of the small intestine between the stomach and jejunum.	Duodenum
C12387	C77529		Specimen	SMALL INTESTINE, ILEUM		The portion of the small intestine between the jejunum and large intestine.	Ileum
C179830	C77529		Specimen	SMALL INTESTINE, JEJUNOILEUM		A region of the small intestine of some animals, between the duodenum and colon, wherein the jejunum and ileum are co-located but not spatially distinct from each other.	Experimental Organism Jejunoileum
C12388	C77529		Specimen	SMALL INTESTINE, JEJUNUM		The portion of the small intestine between the duodenum and ileum.	Jejunum
C88024	C77529		Specimen	SMALL INTESTINE, SACCULUS ROTUNDUS		An anatomic structure exclusive to rabbits that is located at the terminal part of the ileum. It is rich in lymphoid tissue.	Sacculus Rotundus
C12998	C77529		Specimen	SPINAL COLUMN	Vertebral Column	The series of vertebrae and other tissues extending from the skull to the last tailbone.	Vertebral Column
C12464	C77529		Specimen	SPINAL CORD	Medulla Spinalis	The portion of the central nervous system that lies within the vertebral canal and from which the spinal nerves emerge.	Spinal Cord
C12892	C77529		Specimen	SPINAL CORD, CERVICAL		The segment of the spinal cord between the end of the brain stem and the thoracic spinal cord.	Cervical Spinal Cord
C12895	C77529		Specimen	SPINAL CORD, LUMBAR		The segment of the spinal cord between the thoracic spinal cord and the sacral spinal cord.	Lumbar Spinal Cord
C12896	C77529		Specimen	SPINAL CORD, SACRAL		The segment of the spinal cord between the lumbar spinal cord and the caudal spinal cord.	Sacral Spinal Cord
C12894	C77529		Specimen	SPINAL CORD, THORACIC		The segment of the spinal cord between the cervical spinal cord and the lumbar spinal cord.	Thoracic Spinal Cord
C92438	C77529		Specimen	SPIRAL COLON		The ascending colon of the ruminants and pigs. (NCI)	Spiral Colon
C12432	C77529		Specimen	SPLEEN		An abdominal organ that is part of the hematopoietic and immune systems. It is composed of the white pulp and the red pulp and is surrounded by a capsule.	Spleen
C12391	C77529		Specimen	STOMACH		The portion of the gastrointestinal tract located between the esophagus and the proximal duodenum.	Stomach
C12256	C77529		Specimen	STOMACH, CARDIA		The region of the stomach adjacent to the esophogastric junction.	Gastric Cardia
C12257	C77529		Specimen	STOMACH, FUNDUS		The blind sac region of the glandular stomach.	Fundus of the Stomach
C77661	C77529		Specimen	STOMACH, GLANDULAR		The portion of the stomach that contains glandular mucosa.	Glandular Stomach
C77662	C77529		Specimen	STOMACH, NONGLANDULAR	Forestomach	The portion of the stomach that contains stratified squamous mucosa.	Nonglandular Stomach
C12260	C77529		Specimen	STOMACH, PYLORUS		The region of the stomach that connects to the duodenum.	Pylorus
